Section	Division	Group	Class	PkdSuffix	Description
Q	88	88.9	88.91	PKD 88.91.Z	Opieka dzienna nad dziećmi
Q	88	88.9	88.99	PKD 88.99.Z	Pozostała pomoc społeczna bez zakwaterowania, gdzie indziej niesklasyfikowana
R	90	90.0	90.01	PKD 90.01.Z	Działalność związana z wystawianiem przedstawień artystycznych
R	90	90.0	90.02	PKD 90.02.Z	Działalność wspomagająca wystawianie przedstawień artystycznych
R	90	90.0	90.03	PKD 90.03.Z	Artystyczna i literacka działalność twórcza
R	90	90.0	90.04	PKD 90.04.Z	Działalność obiektów kulturalnych
R	91	91.0	91.01	PKD 91.01.A	Działalność bibliotek
R	91	91.0	91.01	PKD 91.01.B	Działalność archiwów
R	91	91.0	91.02	PKD 91.02.Z	Działalność muzeów
R	91	91.0	91.03	PKD 91.03.Z	Działalność historycznych miejsc i budynków oraz podobnych atrakcji turystycznych
R	91	91.0	91.04	PKD 91.04.Z	Działalność ogrodów botanicznych i zoologicznych oraz obszarów i obiektów ochrony przyrody
R	92	92.0	92.00	PKD 92.00.Z	DZIAŁALNOŚĆ ZWIĄZANA Z GRAMI LOSOWYMI I ZAKŁADAMI WZAJEMNYMI
R	93	93.1	93.11	PKD 93.11.Z	Działalność obiektów sportowych
R	93	93.1	93.12	PKD 93.12.Z	Działalność klubów sportowych
R	93	93.1	93.13	PKD 93.13.Z	Działalność obiektów służących poprawie kondycji fizycznej
R	93	93.1	93.19	PKD 93.19.Z	Pozostała działalność związana ze sportem
R	93	93.2	93.21	PKD 93.21.Z	Działalność wesołych miasteczek i parków rozrywki
R	93	93.2	93.29	PKD 93.29.A	Działalność pokojów zagadek, domów strachu, miejsc do tańczenia i w zakresie innych form rozrywki lub rekreacji organizowanych w pomieszczeniach lub w innych miejscach o zamkniętej przestrzeni
R	93	93.2	93.29	PKD 93.29.B	Pozostała działalność rozrywkowa i rekreacyjna, gdzie indziej niesklasyfikowana
S	94	94.1	94.11	PKD 94.11.Z	Działalność organizacji komercyjnych i pracodawców
S	94	94.1	94.12	PKD 94.12.Z	Działalność organizacji profesjonalnych
S	94	94.2	94.20	PKD 94.20.Z	Działalność związków zawodowych
S	94	94.9	94.91	PKD 94.91.Z	Działalność organizacji religijnych
S	94	94.9	94.92	PKD 94.92.Z	Działalność organizacji politycznych
S	94	94.9	94.99	PKD 94.99.Z	Działalność pozostałych organizacji członkowskich, gdzie indziej niesklasyfikowana
S	95	95.1	95.11	PKD 95.11.Z	Naprawa i konserwacja komputerów i urządzeń peryferyjnych
S	95	95.1	95.12	PKD 95.12.Z	Naprawa i konserwacja sprzętu (tele)komunikacyjnego
S	95	95.2	95.21	PKD 95.21.Z	Naprawa i konserwacja elektronicznego sprzętu powszechnego użytku
S	95	95.2	95.22	PKD 95.22.Z	Naprawa i konserwacja urządzeń gospodarstwa domowego oraz sprzętu użytku domowego i ogrodniczego
S	95	95.2	95.23	PKD 95.23.Z	Naprawa obuwia i wyrobów skórzanych
S	95	95.2	95.24	PKD 95.24.Z	Naprawa i konserwacja mebli i wyposażenia domowego
S	95	95.2	95.25	PKD 95.25.Z	Naprawa zegarów, zegarków oraz biżuterii
S	95	95.2	95.29	PKD 95.29.Z	Naprawa pozostałych artykułów użytku osobistego i domowego
S	96	96.0	96.01	PKD 96.01.Z	Pranie i czyszczenie wyrobów włókienniczych i futrzarskich
S	96	96.0	96.02	PKD 96.02.Z	Fryzjerstwo i pozostałe zabiegi kosmetyczne
S	96	96.0	96.03	PKD 96.03.Z	Pogrzeby i działalność pokrewna
S	96	96.0	96.04	PKD 96.04.Z	Działalność usługowa związana z poprawą kondycji fizycznej
S	96	96.0	96.09	PKD 96.09.Z	Pozostała działalność usługowa, gdzie indziej niesklasyfikowana
T	97	97.0	97.00	PKD 97.00.Z	GOSPODARSTWA DOMOWE ZATRUDNIAJĄCE PRACOWNIKÓW
T	98	98.1	98.10	PKD 98.10.Z	Gospodarstwa domowe produkujące wyroby na własne potrzeby
T	98	98.2	98.20	PKD 98.20.Z	Gospodarstwa domowe świadczące usługi na własne potrzeby
U	99	99.0	99.00	PKD 99.00.Z	ORGANIZACJE I ZESPOŁY EKSTERYTORIALNE